{
  "$schema": "../schema/story.schema.json",
  "$comment": "Сюжет главы 3 «Костяные чертоги» (Гласт Хейм): вступление, сцена после моста с мимиком (ch3_s5), сцена перед боссом и финал. Реплики ≤ 120 символов. Реплики героев hero1..hero5 — род по фиксированному полу героя, без конкретной профессии (как в chapter1.json). Грета — hero4, Дорн — hero5: имена и портреты из сохранения. Босс — Тёмный лорд (mob3_boss).",
  "chapter": "chapter3",
  "speakers": {
    "garret": { "name": "Капитан Гаррет", "portrait": "knight" },
    "hero1": { "name": "Алан", "portrait": "hero" },
    "hero2": { "name": "Бран", "portrait": "hero" },
    "hero3": { "name": "Вика", "portrait": "hero" },
    "hero4": { "name": "Грета", "portrait": "hero" },
    "hero5": { "name": "Дорн", "portrait": "hero" },
    "darklord": { "name": "Тёмный лорд", "portrait": "unit:mob3_boss" }
  },
  "scenes": [
    {
      "id": "ch3_intro",
      "trigger": "chapterStart",
      "lines": [
        { "speaker": "garret", "text": "Гласт Хейм. Когда-то здесь пировали рыцари, теперь по залам бродят их кости." },
        { "speaker": "hero5", "text": "Вход через склеп. Внутри рейдрики в пустых доспехах и жрецы, что поднимают мёртвых." },
        { "speaker": "hero3", "text": "Святой воды на всех хватит. Но лучше бы до неё не доходило." },
        { "speaker": "hero4", "text": "Колокольчик затих. Будто и он боится идти дальше." },
        { "speaker": "hero1", "text": "Тогда пойдём первыми. Чертоги не выстоят против нашего строя!" }
      ]
    },
    {
      "id": "ch3_s5_after",
      "trigger": "afterStage",
      "stageId": "ch3_s5",
      "lines": [
        { "speaker": "hero2", "text": "Сундук с зубами! Кто бы знал, что в этом замке даже мебель кусается." },
        { "speaker": "hero5", "text": "Мимики стерегут мост к катакомбам. Дальше — Орден смерти и сам трон." },
        { "speaker": "hero3", "text": "Все целы? Давайте руки, перевяжу, пока тихо." },
        { "speaker": "hero4", "text": "На стенах тот же рогатый знак. Бафомет правда служил кому-то выше." },
        { "speaker": "hero1", "text": "Значит, идём прямо к хозяину. Держимся вместе и не отстаём." }
      ]
    },
    {
      "id": "ch3_s10_before",
      "trigger": "beforeStage",
      "stageId": "ch3_s10",
      "bossIntro": { "title": "Тёмный лорд", "subtitle": "Владыка Гласт Хейма" },
      "lines": [
        { "speaker": "darklord", "text": "Живые в моём тронном зале? Давно никто не приходил сюда своими ногами." },
        { "speaker": "hero5", "text": "Твои мертвецы разорили топи. Пора это закончить." },
        { "speaker": "darklord", "text": "Закончить? Каждый павший здесь встаёт под моё знамя. Вы тоже встанете." },
        { "speaker": "hero2", "text": "Он колдует издалека. Прикроем тыл — и не дадим ему поднять свиту!" },
        { "speaker": "hero1", "text": "Отряд, в строй! За Пронтеру и за Капитана Гаррета!" }
      ]
    },
    {
      "id": "ch3_outro",
      "trigger": "afterStage",
      "stageId": "ch3_s10",
      "lines": [
        { "speaker": "hero3", "text": "Трон пуст. Кости вокруг рассыпались — чары развеялись." },
        { "speaker": "hero5", "text": "Топи теперь спокойны. Спасибо, что пустили в отряд." },
        { "speaker": "hero4", "text": "Колокольчик снова звенит. Но теперь тихо и радостно, будто поёт." },
        { "speaker": "garret", "text": "Новички, говорите? Таких новичков я бы поставил во главе любой гвардии." },
        { "speaker": "garret", "text": "Отдыхайте. Но недолго: гонцы уже несут вести из других земель." },
        { "speaker": "hero1", "text": "Пусть несут. Отряд готов к следующему походу!" }
      ]
    }
  ]
}
